{"candidateId":"exp100-tmdb-14208","curatedMovie":{"attentionDemand":"engaged","curiosityHook":"Flynn holds the trail to King Solomon's Mines, but deciphering the path requires a relic hidden deep within Moroccan ruins.","description":"After a map leading to King Solomon's Mines is stolen, librarian Flynn Carsen must track down a vital cipher piece in Morocco while staying one step ahead of ruthless mercenaries seeking the legendary site.","discoveryStyle":"adventurous","emotionalWeight":"light","filterLanguages":["Arabic","English","French"],"id":"the-librarian-return-to-king-solomon-s-m-2006","moods":["exciting"],"pace":"fast","palette":["#000000","#f0e0c0"],"situations":["friends","family"],"tmdbId":14208,"vibeSummary":"Fast-paced, light, and exciting globe-trotting adventure built on archaeological puzzles and brisk escapes.","whyWatch":"Jonathan Frakes directs an energetic, fast-moving quest filled with ancient ruins, narrow escapes, and lighthearted globe-trotting adventure."},"facts":{"countries":["United States of America"],"director":"Jonathan Frakes","genres":["Action","Adventure","Fantasy"],"posterPath":"/4UxUdJUCLwirPdYzAsYg8ayKhGN.jpg","runtimeMinutes":92,"spokenLanguages":["Arabic","English","French"],"title":"The Librarian: Return to King Solomon's Mines","tmdbId":14208,"year":2006},"provenance":{"evidencePacketHash":"sha256:8746194b808a7d5d0b6e84e753c01785fbd18ea0e4d6f7a0d9f19fd8fd1663ef","factsRecordHash":"sha256:440faa8e15c35ef3c5e60a8d9ad53eea7e75ed19234ab009e139853ed1bae996","finalEditorialArtifactHash":"sha256:b48069167f86aa5766f9f0e18ba105264ffc531d4024089940305545243b0d5f","paletteArtifactHash":"sha256:97905d02a459b92cf7e4851adb9c8e13a94dd37242282de6b621d7648c1a1c2a","promotionCandidateHash":"sha256:cdfc14b778236ddbad87c55805c89e8c3e9a7f813bef9719ff3e005f46456097","semanticArtifactHash":"sha256:0db365f0471a19d64addc122b5770ff4b2f15e1a02417e37b57d0ff49feb9caf"},"schemaVersion":"production-record.v2","tmdbId":14208}
