{"candidateId":"scale500-tmdb-15080","curatedMovie":{"attentionDemand":"engaged","curiosityHook":"As childhood memories steadily reemerge to mirror her adult choices, how will confronting her younger self reshape what she wants from her future?","description":"Directed by Isao Takahata, this animated drama follows Taeko as she moves between her current adult life and vivid memories of her youth, questioning whether she has stayed true to the dreams of her childhood self.","discoveryStyle":"different","emotionalWeight":"moderate","filterLanguages":["Japanese"],"id":"only-yesterday-1991","moods":["thoughtful","emotional"],"pace":"slow","palette":["#000010","#ffffff"],"situations":["alone"],"tmdbId":15080,"vibeSummary":"Thoughtful, slow-paced, and gently emotional, demanding attentive solo viewing for its reflective drama.","whyWatch":"Takahata crafts a patient, lyrical exploration of memory and personal growth, offering an animated drama that treats quiet reflection with warmth and delicate emotional weight."},"facts":{"countries":["Japan"],"director":"Isao Takahata","genres":["Animation","Drama","Romance"],"posterPath":"/tOSnFE9e82iH3ZAzSTtuOkBsabJ.jpg","runtimeMinutes":119,"spokenLanguages":["Japanese"],"title":"Only Yesterday","tmdbId":15080,"year":1991},"provenance":{"evidencePacketHash":"sha256:ce2b841b2d475047852431eaf5120bd0f47f8e2da91dd3d1aef10e663388c47b","factsRecordHash":"sha256:a6037a79702769d5b83e7bb6cc2f5fcb51c82612a732f428c4f3be6f8cd5b0d5","finalEditorialArtifactHash":"sha256:74ce8a755812a96996a04e37db0caafa207dea11b3d7bfcdc0aab8a19d2e1377","paletteArtifactHash":"sha256:1a1d2e95474f0f8ac0a987a0112593ab74f61a2eb4996da65b28903cfbbbadfc","promotionCandidateHash":"sha256:fc5a8805fc21dd33ce56df3e9c1fa392f1c5b793cc995aaf3090b7724ff9d16f","semanticArtifactHash":"sha256:6555102819d79167c9dd8f48bc2e100de7f269a9ca8ee65febe630f9e5838d94"},"schemaVersion":"production-record.v2","tmdbId":15080}
