{"candidateId":"scale500-tmdb-5491","curatedMovie":{"attentionDemand":"engaged","curiosityHook":"With humanity reduced to a primitive state under Psychlo rule, how can a lone captive turn the tide against Terl's empire?","description":"In the year 3000, the alien Psychlos strip Earth of its resources and enslave the surviving humans. Captured by the ruthless Terl, Tyler must spark a fight to reclaim mankind's future.","discoveryStyle":"adventurous","emotionalWeight":"moderate","filterLanguages":["English","French"],"id":"battlefield-earth-2000","moods":["exciting"],"pace":"fast","palette":["#101010","#ffffff"],"situations":["friends"],"tmdbId":5491,"vibeSummary":"Exciting, fast-moving sci-fi action with moderate emotional weight that delivers an adventurous, high-energy crowd watch.","whyWatch":"Directed by Roger Christian, this fast-paced sci-fi adventure offers pure spectacle, pitching an outmatched human rebellion against an overpowering alien conquest."},"facts":{"countries":["United States of America"],"director":"Roger Christian","genres":["Action","Adventure","Science Fiction"],"posterPath":"/wXCRuBHdJ5aTFQdsuGJFXNdo79T.jpg","runtimeMinutes":117,"spokenLanguages":["English","French"],"title":"Battlefield Earth","tmdbId":5491,"year":2000},"provenance":{"evidencePacketHash":"sha256:cc7b14df29b694dd6485b307b8ddf2ab8a4f62914cb7219d6de853673068a839","factsRecordHash":"sha256:3b2e302bf02a6d08d6698bfb9b123f3af99c7abcb46f9f8729112cdeb442f3ae","finalEditorialArtifactHash":"sha256:47994e39b15a571affe9cc22bd68f7cbdc75f4ab53663ed624fc5f790c067dce","paletteArtifactHash":"sha256:e02eb85d6c918598a16a9fe40684d6619749b9f509f3ecb31c72bf49331e6753","promotionCandidateHash":"sha256:5740faf9f0729115dda90e988e2559220f414e6574b79906d1b5f60652561ac0","semanticArtifactHash":"sha256:ad816d7ae3962f02f28d60ca9632f3276f483ca68e21b0ce991f771217184fa9"},"schemaVersion":"production-record.v2","tmdbId":5491}
