{"candidateId":"scale500-tmdb-211954","curatedMovie":{"attentionDemand":"easy","curiosityHook":"Why does Valentin leave Mexico with a baby after a former fling leaves her on his doorstep?","description":"Acapulco playboy Valentin leaves Mexico with a baby after a former fling leaves her on his doorstep.","discoveryStyle":"familiar","emotionalWeight":"moderate","filterLanguages":["English","Spanish"],"id":"instructions-not-included-2013","moods":["funny","emotional"],"pace":"medium","palette":["#100000","#ffd040"],"situations":["family","easy-watch"],"tmdbId":211954,"vibeSummary":"An accessible, warm comedy-drama with steady pacing and heartfelt emotional beats.","whyWatch":"Eugenio Derbez blends broad comedic charm with heartfelt stakes, making an unprepared bachelor's journey both funny and genuinely moving."},"facts":{"countries":["Mexico","United States of America"],"director":"Eugenio Derbez","genres":["Comedy","Drama"],"posterPath":"/x3Ygv0aZbZ3iUMeXyIlSu0Ugyp5.jpg","runtimeMinutes":122,"spokenLanguages":["English","Spanish"],"title":"Instructions Not Included","tmdbId":211954,"year":2013},"provenance":{"evidencePacketHash":"sha256:8e99cda9be5436ad02504a343c16fd0e3cbea878fba5c855d117494685fc54b8","factsRecordHash":"sha256:ab71d0870ca6ab11b77c3af208a1f0d13f16206a36e1b625b802c1fa9abf9138","finalEditorialArtifactHash":"sha256:b593d3b375e47922709e39771ba7445723427a729ecedd773942bd573639f565","paletteArtifactHash":"sha256:71443185e6b343963e014fec76cf5344787ede648c335be1b24e654973a42094","promotionCandidateHash":"sha256:83f1e730f1f83acf79b65cd3f2a40649882afdca9a333d482b12f145d1571739","semanticArtifactHash":"sha256:9dd02bf85c4c1204792d3b44563632afd2170ff95de78859bb9f92534f99cefe"},"schemaVersion":"production-record.v2","tmdbId":211954}
