{"candidateId":"exp100-tmdb-32823","curatedMovie":{"attentionDemand":"easy","curiosityHook":"Can an eager intern manage the spiraling antics of an out-of-control idol long enough to pull off a career-saving comeback show?","description":"To save a struggling record label, intern Aaron Green takes on the daunting assignment of escorting his idol, unhinged rock star Aldous Snow, to Los Angeles for an essential comeback performance.","discoveryStyle":"familiar","emotionalWeight":"light","filterLanguages":["English"],"id":"get-him-to-the-greek-2010","moods":["funny"],"pace":"medium","palette":["#000000","#80c0c0"],"situations":["friends","easy-watch"],"tmdbId":32823,"vibeSummary":"Irreverent, funny, and briskly paced, offering an easy-watching music adventure perfect for a fun night with friends.","whyWatch":"Directed by Nicholas Stoller, this music-fueled comedy blends showbiz satire with high-stress antics as an eager intern attempts to wrangle an out-of-control rock star."},"facts":{"countries":["United States of America"],"director":"Nicholas Stoller","genres":["Adventure","Comedy","Music"],"posterPath":"/6g0li87w8LIK77QRUtOkQkM6bD7.jpg","runtimeMinutes":109,"spokenLanguages":["English"],"title":"Get Him to the Greek","tmdbId":32823,"year":2010},"provenance":{"evidencePacketHash":"sha256:eb412bbd149c8a98b3cbf1d5ac1969190457494c8fa30b050d0e07cae84a4200","factsRecordHash":"sha256:2917fee3c32fc8d0ffe6ee2e3ac1ad7743ec88d3d4d151b27fa2239e1325e114","finalEditorialArtifactHash":"sha256:1fca0d8d30a91401480982aed207486c1fbe630e9b6ac233ad53fc5d165a772f","paletteArtifactHash":"sha256:96a1593515cbc8b279212c053ddde1b59442ab2e0eb76dc59caf112d58b77fbd","promotionCandidateHash":"sha256:2b35bbf4aced93653e1157823f72b5f0ab6608bbb7126f18401273b92ed0cdda","semanticArtifactHash":"sha256:61810a3dd73c4f71b41c63c7a001657bd76526573b99c19c922fe496bf0c9ca0"},"schemaVersion":"production-record.v2","tmdbId":32823}
