{"candidateId":"scale500-tmdb-586863","curatedMovie":{"attentionDemand":"engaged","curiosityHook":"What does the drone’s recording threaten to expose after Stéphane and his colleagues are overrun during an arrest?","description":"After joining an Anti-Crime Squad in the Paris suburb of Montfermeil, officer Stéphane navigates soaring neighborhood frictions until a chaotic arrest is caught on camera by a local drone.","discoveryStyle":"different","emotionalWeight":"heavy","filterLanguages":["French"],"id":"les-miserables-2019","moods":["suspenseful","thoughtful","emotional"],"pace":"medium","palette":["#000010","#e0f0ff"],"situations":["alone"],"tmdbId":586863,"vibeSummary":"Tense, socially charged, and heavy. A steady, pressure-cooker thriller best experienced with undivided focus.","whyWatch":"Ladj Ly delivers a gripping, grounded crime drama where street-level pressures and institutional fractures collide with volatile urgency."},"facts":{"countries":["France"],"director":"Ladj Ly","genres":["Crime","Drama","Thriller"],"posterPath":"/2ZQV9rPFXF0iFfKbsAvVIweQ1yM.jpg","runtimeMinutes":104,"spokenLanguages":["Bambara","French"],"title":"Les Misérables","tmdbId":586863,"year":2019},"provenance":{"evidencePacketHash":"sha256:93a828928cdbcb37f626459ae0710d5226340d16bcb29bc1aee5a53d4f83583a","factsRecordHash":"sha256:c422d596c1f1a0fa891e92e4b2205e25d7d95b522552e99a17f70d11301b2926","finalEditorialArtifactHash":"sha256:f4bbb34a47d48e44f112d3fe3f166ef0240926b7ba207965ddf1ed44710dd966","paletteArtifactHash":"sha256:8f8d4ac0bd6275314a4546280f8e5f721d1ae5ed3d6e0da58502651b19c29466","promotionCandidateHash":"sha256:3aaf3502f321fcd68e53ecd1a5e1ce0a27deef189a97569d1f4ca7f5e92c86b7","semanticArtifactHash":"sha256:dd80bc377d33f021a6b6fc80efd0accd3766c4f32446646db1d67fc299a171cc"},"schemaVersion":"production-record.v2","tmdbId":586863}
