{"candidateId":"scale500-tmdb-9317","curatedMovie":{"attentionDemand":"easy","curiosityHook":"What happens when intergalactic travelers travel across the cosmos only to develop an obsession with rustic farm cooking?","description":"In Jean Girault's French sci-fi comedy, two rural buddy farmers find their quiet routines upended when extraterrestrial visitors drop by with a surprising craving for their homemade cabbage soup.","discoveryStyle":"different","emotionalWeight":"light","filterLanguages":["French"],"id":"the-cabbage-soup-1981","moods":["funny"],"pace":"medium","palette":["#101010","#ffffff"],"situations":["friends","easy-watch"],"tmdbId":9317,"vibeSummary":"Light, playful, and easy to watch, offering broad comic warmth and steady pacing ideal for a casual night with friends.","whyWatch":"Blending classic French farce with playful science fiction, this lighthearted collision of countryside domesticity and flying saucers delivers an offbeat, easy-going laugh."},"facts":{"countries":["France"],"director":"Jean Girault","genres":["Comedy","Science Fiction"],"posterPath":"/eT52CpkNpVrFqamL2WD6iMZuChf.jpg","runtimeMinutes":98,"spokenLanguages":["French"],"title":"The Cabbage Soup","tmdbId":9317,"year":1981},"provenance":{"evidencePacketHash":"sha256:27a357c7520a9ca870aa672ef7630b53da2b40ff227044285bdca46ec2f5a554","factsRecordHash":"sha256:ad2b4f682afc8b16010feb30e144c180080ec55ec643d5e09fc99bcd713a6c57","finalEditorialArtifactHash":"sha256:18b5172a3bb6a9b150b93596289978833a2b259cf1ce60159d5ddd7c0cf9e320","paletteArtifactHash":"sha256:f8aedef37c9817e6fb81120e544053f188fe0687ce94123ce98221d65325eb9b","promotionCandidateHash":"sha256:51d5b02e0c3c505a93d5da2ab8db2e112f54e63915bbf2155cbf7ac53b6bc4b1","semanticArtifactHash":"sha256:08bcda43d82ca77183089a40c68d44f6657e585501a5610589ada301d54f370e"},"schemaVersion":"production-record.v2","tmdbId":9317}
