{"candidateId":"scale500-tmdb-8987","curatedMovie":{"attentionDemand":"engaged","curiosityHook":"Can Gail and Tom hold together as their rafting holiday becomes a nightmare?","description":"A strained couple takes their son on a Montana rafting trip, then encounters two mysterious men whose desperation turns it into a nightmare.","discoveryStyle":"adventurous","emotionalWeight":"heavy","filterLanguages":["English"],"id":"the-river-wild-1994","moods":["suspenseful","exciting"],"pace":"fast","palette":["#0090c0","#70c0e0"],"situations":["date-night"],"tmdbId":8987,"vibeSummary":"Fast-paced, suspenseful, and emotionally tense. An adrenaline-charged river survival adventure with high dramatic stakes.","whyWatch":"Curtis Hanson steers a high-stakes outdoor thriller, fusing intense river rapids with simmering family drama for a gripping, pulse-pounding ride."},"facts":{"countries":["United States of America"],"director":"Curtis Hanson","genres":["Adventure","Drama","Thriller"],"posterPath":"/wVgQ2T63ThjIsY4R0qoHXjyllql.jpg","runtimeMinutes":111,"spokenLanguages":["English"],"title":"The River Wild","tmdbId":8987,"year":1994},"provenance":{"evidencePacketHash":"sha256:689231befbb01af9f4698a4cecac72414b26df6c1d159f2aca996f019cfd76ba","factsRecordHash":"sha256:54529cc8a081a8f3c43cb5c06fed8d0243e86e8f0cc6bda22130121a6416c1e7","finalEditorialArtifactHash":"sha256:6fbf80ab153c40dbbdf523a67fbf9e2bb4db14e726ee8adbc5b5a395c5bf7332","paletteArtifactHash":"sha256:c89408dcf58b4af722a21f084c35bd404059c305df4b208a39c203ce1a5324f4","promotionCandidateHash":"sha256:c36a3419619ff8ef8ff41da966246831b938ea46686b90355eee72497b837701","semanticArtifactHash":"sha256:f3c213218cd395b785a7ac68270338a705e13ea53dfd6df0574f3c4a886ed4aa"},"schemaVersion":"production-record.v2","tmdbId":8987}
