{"candidateId":"scale500-tmdb-483","curatedMovie":{"attentionDemand":"engaged","curiosityHook":"With a pack of killers closing in on the highway, can the runaway lovers outrace the vindictive reach of Lula’s mother?","description":"Young lovers Sailor and Lula take to the open highway to build a future together, fleeing the wrath of Lula’s deranged mother, who sends a relentless squad of contract killers to bring their surreal honeymoon to an end.","discoveryStyle":"different","emotionalWeight":"heavy","filterLanguages":["English","Spanish"],"id":"wild-at-heart-1990","moods":["exciting","emotional","suspenseful"],"pace":"fast","palette":["#000000","#e05080"],"situations":["date-night"],"tmdbId":483,"vibeSummary":"Fast, intense, and surreal road-trip thriller mixing dark criminal danger with passionate romance.","whyWatch":"David Lynch steers a feverish blend of crime thriller and road-trip romance, infusing an elopement with raw emotional stakes and escalating danger."},"facts":{"countries":["Germany","United States of America"],"director":"David Lynch","genres":["Crime","Romance","Thriller"],"posterPath":"/uLUFI5sJIfWrBUWB2Y1dEuyvvVy.jpg","runtimeMinutes":125,"spokenLanguages":["English","Spanish"],"title":"Wild at Heart","tmdbId":483,"year":1990},"provenance":{"evidencePacketHash":"sha256:d386ea0a9e8da1105375f271184e51207e5d57e08e22bd7333db8ae9d3eca71b","factsRecordHash":"sha256:fd6b1734311de3dc3c1a1c9ea5784f621eda892b0c13f8b297423b6c23613edb","finalEditorialArtifactHash":"sha256:09873197b7626076ddad4de78c06ee6cc45fac9ddd06da5314d80eb8cb3c63c8","paletteArtifactHash":"sha256:615fa199f3a18953b24144c2d26a6fb8f18b53aff6bd32614f25824de686c761","promotionCandidateHash":"sha256:d111757da7df6b62d6679378c8efa7336805bbf17ba439acdd8356a95e3a7964","semanticArtifactHash":"sha256:406452ad2606b76caace2135da73293f218310b1f3c64a23853c064eb02b7bdd"},"schemaVersion":"production-record.v2","tmdbId":483}
