{"candidateId":"scale500-tmdb-14506","curatedMovie":{"attentionDemand":"engaged","curiosityHook":"As the Baron spins his outrageous recollections, can his ragtag crew pull through the increasingly unbelievable perils he describes?","description":"Baron Munchausen recounts supposed travels and fantastical experiences shared with his band of misfits.","discoveryStyle":"adventurous","emotionalWeight":"light","filterLanguages":["English"],"id":"the-adventures-of-baron-munchausen-1988","moods":["funny","exciting"],"pace":"medium","palette":["#101010","#f0e0c0"],"situations":["friends","family"],"tmdbId":14506,"vibeSummary":"Exciting, funny, and lighthearted fantasy with a steady pace that rewards an engaged family or friends night.","whyWatch":"This adventure-comedy fantasy follows a larger-than-life storyteller and his band of misfits through fantastical experiences."},"facts":{"countries":["Germany","United Kingdom","United States of America"],"director":"Terry Gilliam","genres":["Adventure","Comedy","Fantasy"],"posterPath":"/oiOwGRqwrKpg1EMUlPgRjVC49bn.jpg","runtimeMinutes":126,"spokenLanguages":["English"],"title":"The Adventures of Baron Munchausen","tmdbId":14506,"year":1988},"provenance":{"evidencePacketHash":"sha256:fc2b336db031186fad67719052352966776559e5aed209e7f767054e11116b63","factsRecordHash":"sha256:bc23918bcf44c85401119fbfc2c6b8ac79ce7e47c3ad52c0c8632346d6260032","finalEditorialArtifactHash":"sha256:8ecf4a75678c5e0531e665d9bbb67307a88903058c137195b5570d61a4dd418c","paletteArtifactHash":"sha256:a7aab44872c8fdb482ac9304c71db6c04091cca93593884566036a87dba676e7","promotionCandidateHash":"sha256:42ded678c1c316a36dc40238b5645c8d9fd3349100871a2fa5210472f1cb3a35","semanticArtifactHash":"sha256:fb67748f42ef65f61f7f8c182d3764e7cbddfd67cc1cd8b9349e58a721173d47"},"schemaVersion":"production-record.v2","tmdbId":14506}
