{"candidateId":"scale500-tmdb-9281","curatedMovie":{"attentionDemand":"engaged","curiosityHook":"When the line between protector and target blurs, how long can an outsider remain hidden inside a world that lives apart?","description":"After an Amish boy witnesses a brutal murder, the detective assigned to shield him and his mother finds his own life in jeopardy, compelling him to hide within their quiet, insular community.","discoveryStyle":"different","emotionalWeight":"heavy","filterLanguages":["English","German"],"id":"witness-1985","moods":["suspenseful","emotional"],"pace":"medium","palette":["#000000","#f02000"],"situations":["alone"],"tmdbId":9281,"vibeSummary":"Suspenseful, emotionally weighty, and deliberate, balancing acute danger with an observant, secluded atmosphere.","whyWatch":"Directed by Peter Weir, this tense crime drama pairs lethal stakes with the steady, contemplative rhythms of life in an unfamiliar world."},"facts":{"countries":["United States of America"],"director":"Peter Weir","genres":["Crime","Drama","Thriller"],"posterPath":"/kOymD1rChAMykmDVEzJpIh4OYS7.jpg","runtimeMinutes":112,"spokenLanguages":["English","German"],"title":"Witness","tmdbId":9281,"year":1985},"provenance":{"evidencePacketHash":"sha256:5402413b0297864fd61d24423adacfc7190246a905869f1e2f6a89118a737aa4","factsRecordHash":"sha256:4a681a3e06614ed39f19b3270c8bf489d8c62d8fa71229f9b298ff870ae80500","finalEditorialArtifactHash":"sha256:7f5e17e22c9b841d19d7910af9ecbaa88e9d252b0f9dc50d18d5940cc1d83d32","paletteArtifactHash":"sha256:c7cba1592f80c760e1e7c1ec4ff42e97c4ea355ad893a8184516cf18c82ef8db","promotionCandidateHash":"sha256:e41bd9c3ac63a6f37f3f444e9cf857e2c230b78a71c37c0b8a71a73a3127dec1","semanticArtifactHash":"sha256:c3c289e6c3eeea27181c3dabad76fa30c0d79fa1d938d881b2f4b430f3d2500b"},"schemaVersion":"production-record.v2","tmdbId":9281}
