{"candidateId":"scale500-tmdb-25300","curatedMovie":{"attentionDemand":"engaged","curiosityHook":"What horrifying truth did Michele uncover beneath the ruins of the deserted farmhouse, and why must he keep it from everyone?","description":"In a sun-scorched Italian village surrounded by endless wheat fields, nine-year-old Michele explores an abandoned farmhouse and stumbles upon a shocking secret he is terrified to reveal.","discoveryStyle":"different","emotionalWeight":"heavy","filterLanguages":["Italian"],"id":"i-m-not-scared-2003","moods":["suspenseful","emotional"],"pace":"medium","palette":["#000000","#0050d0"],"situations":["alone"],"tmdbId":25300,"vibeSummary":"A sun-drenched yet heavy mystery balancing deliberate pacing with mounting suspense.","whyWatch":"The scorched countryside and a child’s discovery of a terrible secret give the story a tense, unsettling pull."},"facts":{"countries":["Italy","Spain","United Kingdom"],"director":"Gabriele Salvatores","genres":["Crime","Drama","Mystery","Thriller"],"posterPath":"/vTf4qR0OSuV4qBT8As4QoWxSJSq.jpg","runtimeMinutes":108,"spokenLanguages":["Italian"],"title":"I'm Not Scared","tmdbId":25300,"year":2003},"provenance":{"evidencePacketHash":"sha256:d60ade76d183981a59e8df72471cb763716b9a1e90e9f7553af7cbd2d65a2448","factsRecordHash":"sha256:9f58f8afff4801ca18a25b86f4bcc5d1081e4082e343a75ffc0bff3098bab93b","finalEditorialArtifactHash":"sha256:9c97ec999c52d3e6ce580a3b54f5075ea5109441af9606d313f16dbc77621e0c","paletteArtifactHash":"sha256:759cf0ca5dec673ff44dc5b0657b398d43972236a38f8505fa4585646e3406f0","promotionCandidateHash":"sha256:17f251410380b52c84124ac2468fd53a6b8db52e486b2078c527812fe162d88d","semanticArtifactHash":"sha256:43ffaf3cfc29a8b086e74d519c141510cb9ee47951f9928415166c9a70b2bd84"},"schemaVersion":"production-record.v2","tmdbId":25300}
