{"candidateId":"scale500-tmdb-10226","curatedMovie":{"attentionDemand":"immersive","curiosityHook":"When a tranquil family farmhouse becomes the stage for an endless siege of terror, will either friend survive the night?","description":"Best friends Marie and Alexia head to an isolated countryside farmhouse for a peaceful weekend with Alexia's parents, but their quiet retreat collapses into an unrelenting night of terror.","discoveryStyle":"different","emotionalWeight":"heavy","filterLanguages":["English","French","Italian"],"id":"high-tension-2003","moods":["suspenseful"],"pace":"fast","palette":["#201010","#90a070"],"situations":["friends"],"tmdbId":10226,"vibeSummary":"Fast, heavy, and intensely suspenseful; an immersive horror thriller set in isolated countryside dread.","whyWatch":"Its secluded-farmhouse setup gives this horror thriller a focused overnight premise that turns a friendly visit into sustained tension."},"facts":{"countries":["France","Romania"],"director":"Alexandre Aja","genres":["Horror","Mystery","Thriller"],"posterPath":"/vKeFa7CqSxmWsQDjHP6SJXKoDbj.jpg","runtimeMinutes":91,"spokenLanguages":["English","French","Italian"],"title":"High Tension","tmdbId":10226,"year":2003},"provenance":{"evidencePacketHash":"sha256:9f0e2a1e120eefe66027fdf9975f4057a3b816435f6f209ea5da0a1b63d52f12","factsRecordHash":"sha256:55c4d6314cff0c7adb6c4d0585d8573ee4b3ad35278b548933709303da5a43e7","finalEditorialArtifactHash":"sha256:8cfdd966e1126a5902f1717afd1ee078fcf19364dd11e755c5d786e7ac18d8a3","paletteArtifactHash":"sha256:52cb16506d34e2f793be2d67dca2ff32c2aea2d734da2190dc54e7795857376b","promotionCandidateHash":"sha256:9362c25a39281556abfe56f74b3ceb8602a6d5561ca8e58934065e36e184d2f2","semanticArtifactHash":"sha256:81a37bcbf44463033d96b288ba6b9142eb51dedb98c15a5078c2c9f8e728df66"},"schemaVersion":"production-record.v2","tmdbId":10226}
