{"candidateId":"exp100-tmdb-10246","curatedMovie":{"attentionDemand":"easy","curiosityHook":"After a corrupt club owner and the local sheriff con them, how far will these humiliated teens go to pull off their payback?","description":"In 1954 Florida, a crew of high school classmates ventures out to an Everglades strip club. After the crooked owner and his sheriff brother take their cash and humiliate them, the teens scheme to get even.","discoveryStyle":"familiar","emotionalWeight":"light","filterLanguages":["English"],"id":"porky-s-1981","moods":["funny"],"pace":"medium","palette":["#d00000","#f0f0f0"],"situations":["friends"],"tmdbId":10246,"vibeSummary":"Light, rowdy, and easygoing comedy with a steady comic rhythm and low emotional stakes.","whyWatch":"Bob Clark delivers a raucous, briskly paced 1950s sex comedy fueled by high-spirited mischief, small-town corruption, and a shared drive for payback."},"facts":{"countries":["Canada"],"director":"Bob Clark","genres":["Comedy"],"posterPath":"/AqCOt1cWfKqCepxK7LIdT812idH.jpg","runtimeMinutes":94,"spokenLanguages":["English"],"title":"Porky's","tmdbId":10246,"year":1981},"provenance":{"evidencePacketHash":"sha256:7a3b2f1b33d14938890b5941d8c85c874db58777bc9d722e6afbe3ed7c79ea72","factsRecordHash":"sha256:7fcd430c576ff63b851e29fb100dec4eb4f576de635a40071faefa71d5bc9557","finalEditorialArtifactHash":"sha256:ed185dd7d0bce27449d370419b1305090abe6265fd4484b55a38315789a9704e","paletteArtifactHash":"sha256:98d7b4530eca5afcb7f47fb823577a9884ae5a9a76757d99ff42b13e94e1e397","promotionCandidateHash":"sha256:121a21047b03272772d4690d71dac0ad4feda0c414255d8c82b6efd2a5b5848c","semanticArtifactHash":"sha256:c3ed4c280fe0ba821e48621237cd63af6b2a0e2bde1cbd57e27d0424fc6be537"},"schemaVersion":"production-record.v2","tmdbId":10246}
