{"candidateId":"exp100-tmdb-13151","curatedMovie":{"attentionDemand":"engaged","curiosityHook":"When their haunted island case turns up true terrors, will the reunited gang survive an eerie bayou full of real monsters?","description":"Reuniting after drifting apart, Fred, Daphne, Velma, Shaggy, and Scooby-Doo travel to a secluded bayou island to investigate a pirate ghost, only to encounter zombies and cat creatures that seem genuinely real.","discoveryStyle":"familiar","emotionalWeight":"moderate","filterLanguages":["English"],"id":"scooby-doo-on-zombie-island-1998","moods":["suspenseful","funny"],"pace":"medium","palette":["#001010","#fff000"],"situations":["family","easy-watch"],"tmdbId":13151,"vibeSummary":"Spooky family mystery with a steady rhythm, mixing classic animated laughs with genuinely creepy bayou thrills.","whyWatch":"It refreshes classic cartoon sleuthing by raising the stakes, injecting genuine horror chills and eerie bayou atmosphere into a brisk animated mystery."},"facts":{"countries":["United States of America"],"director":"Jim Stenstrum","genres":["Animation","Family","Horror","Mystery"],"posterPath":"/7EdvFUGvT5Pn8rUFRKCrdUzNthf.jpg","runtimeMinutes":77,"spokenLanguages":["English"],"title":"Scooby-Doo on Zombie Island","tmdbId":13151,"year":1998},"provenance":{"evidencePacketHash":"sha256:39cb7fd6ed8571f87ca7f5929051b4c431c162d402276bf558cf86454f8f5389","factsRecordHash":"sha256:5292d8d4f7b7d5eb1226830bf1ffddd5815b74ca768e483aa0828d49835a797a","finalEditorialArtifactHash":"sha256:4dde135a8de8d1adf991c53bf2340fa0587f2e15225b1f214e47f8884297cf5a","paletteArtifactHash":"sha256:d2a112877783fc8dde26b947a8c99e7a1413f92c58a611dad6b5482be43ba6eb","promotionCandidateHash":"sha256:fbfc1953b8ca8fb25ee2671353aa7267bbaa8974af38124f5015c2eda110b77a","semanticArtifactHash":"sha256:3eaa4185c9dbc38bcf38c3f939d45b2b6727059666c8168d6e53a6872a4f1585"},"schemaVersion":"production-record.v2","tmdbId":13151}
