{"candidateId":"scale500-tmdb-39108","curatedMovie":{"attentionDemand":"engaged","curiosityHook":"Can Goku perfect a new technique to defeat the monster found with Tapion in the music box?","description":"The Z Warriors open a music box with Dragon Balls and find Tapion, sealed inside with a monster called Hildegarn.","discoveryStyle":"familiar","emotionalWeight":"moderate","filterLanguages":["Japanese"],"id":"dragon-ball-z-wrath-of-the-dragon-1995","moods":["exciting","suspenseful"],"pace":"fast","palette":["#203020","#fff010"],"situations":["friends","family"],"tmdbId":39108,"vibeSummary":"Fast, exciting, and accessible, offering high-stakes animated action that works easily for group movie nights.","whyWatch":"Clocking in at 51 fast-paced minutes, Mitsuo Hashimoto’s film delivers lean, suspenseful martial arts spectacle centered on a massive threat and Goku's push to master a new skill."},"facts":{"countries":["Japan"],"director":"Mitsuo Hashimoto","genres":["Action","Animation","Science Fiction"],"posterPath":"/7uRu9EA3nie0n2mlVDDLlTI3IzC.jpg","runtimeMinutes":51,"spokenLanguages":["Japanese"],"title":"Dragon Ball Z: Wrath of the Dragon","tmdbId":39108,"year":1995},"provenance":{"evidencePacketHash":"sha256:b339480a73766a3e4387354b475a34f26804e9eb33ba6d77277018951a936682","factsRecordHash":"sha256:6f2d0150ce842792f22012cff93a4d6b6204aec38baeddb95568d265b46f6643","finalEditorialArtifactHash":"sha256:664e4ebf735abcddabcf736998c05c2cbc0ef8916450b04358844c76ccb7ffd2","paletteArtifactHash":"sha256:e56ba92ebd9bc171be516c19040dad8d8aac7cd5fc42506e3f0059e420285b8b","promotionCandidateHash":"sha256:a68881f6ad979dc9d4079169f1c09458ffdb733794abfb99c698513cbbe90829","semanticArtifactHash":"sha256:b4c25dafd282eb5b44a0edbfa1ff46481d24182eb4548f51e7dbf9b3f95f8597"},"schemaVersion":"production-record.v2","tmdbId":39108}
