{"candidateId":"scale500-tmdb-399121","curatedMovie":{"attentionDemand":"engaged","curiosityHook":"With an innocent captain condemned to exile for treason, the lingering question is how a military hierarchy's corrupt certainty might ever be challenged.","description":"In 1894, French army Captain Alfred Dreyfus faces a devastating miscarriage of justice when he is wrongfully convicted of treason and sentenced to life imprisonment on the brutal Devil's Island penal colony.","discoveryStyle":"different","emotionalWeight":"heavy","filterLanguages":["French"],"id":"an-officer-and-a-spy-2019","moods":["thoughtful","emotional","suspenseful"],"pace":"slow","palette":["#101010","#ffffff"],"situations":["alone"],"tmdbId":399121,"vibeSummary":"A slow-burning, emotionally heavy French period thriller demanding engaged, focused attention.","whyWatch":"Director Roman Polanski crafts a deliberate, suspenseful historical thriller about institutional failure, mounting paranoia, and the devastating human cost of a fabricated verdict."},"facts":{"countries":["France","Italy"],"director":"Roman Polanski","genres":["Drama","History","Thriller"],"posterPath":"/kqlzmKVBpGz7OMWfOXlK4y1m9Uz.jpg","runtimeMinutes":132,"spokenLanguages":["French"],"title":"An Officer and a Spy","tmdbId":399121,"year":2019},"provenance":{"evidencePacketHash":"sha256:2ff30623227e171723152773c5c9704a33113302f3b0edf1dea723b291b2466a","factsRecordHash":"sha256:e79878e48e8b9475038c58c54f733da813f0806c3711455b8b7cd2cf047a89c1","finalEditorialArtifactHash":"sha256:e5cbc0178d6230c64439b35946db70e9ec3039d0da1459c654d8908f5f6bc77b","paletteArtifactHash":"sha256:53fc54c7a66c4fa2dab6908ae22382eaa2733ef49988a1a58ac35615aee4dcb6","promotionCandidateHash":"sha256:175707b49f5013b32e037b5a962301923d21d955c84f8072c6eb4972fe15f3c2","semanticArtifactHash":"sha256:b89db2ee3d20249b7535b9a0972b370e3635a931e3f399d3f1cda61a1f553e79"},"schemaVersion":"production-record.v2","tmdbId":399121}
