{"candidateId":"scale500-tmdb-26505","curatedMovie":{"attentionDemand":"easy","curiosityHook":"With Princess Selenia cornered by the villainous Maltazard, can Arthur's rescue effort reach her in time?","description":"Arthur responds when Princess Selenia sends a distress call about the threat posed by Maltazard.","discoveryStyle":"adventurous","emotionalWeight":"light","filterLanguages":["English"],"id":"arthur-and-the-revenge-of-maltazard-2009","moods":["exciting"],"pace":"medium","palette":["#102010","#f0c030"],"situations":["family"],"tmdbId":26505,"vibeSummary":"Exciting, imaginative, and light on heavy emotional weight, this family fantasy offers an easy, steady ride.","whyWatch":"This animated family fantasy begins with Arthur answering a princess’s call for help against Maltazard."},"facts":{"countries":["France"],"director":"Luc Besson","genres":["Adventure","Animation","Family","Fantasy"],"posterPath":"/rHCL0HwlQvU01TLRRHZFlvsVEqt.jpg","runtimeMinutes":93,"spokenLanguages":["English"],"title":"Arthur and the Revenge of Maltazard","tmdbId":26505,"year":2009},"provenance":{"evidencePacketHash":"sha256:6c54f9aaaab63267eab7d3e69623e7f936d2c63c19910603383d008063e5fbf2","factsRecordHash":"sha256:9a1e21a6b5937f0d34958ed5ca8a04058c7bbd5bef554242d35f96652bd4bf56","finalEditorialArtifactHash":"sha256:6c5b99b0a9f1f224ddac407eab30e4197721d964dea386133bda1aca303edb41","paletteArtifactHash":"sha256:9cc574659eb8b216beaa355cf7e7586d300ea20efa1530675485877ab84ff99c","promotionCandidateHash":"sha256:8c0d605366ba67b204bbd6a3d08d24e7512701b9f65cdbe22f98e232ddcbe3e6","semanticArtifactHash":"sha256:aaf6e1dc59beb4822dbb0c8d4ceb47b008a5c0ab6731df3b14a907e785695b69"},"schemaVersion":"production-record.v2","tmdbId":26505}
