{"candidateId":"scale500-tmdb-425505","curatedMovie":{"attentionDemand":"engaged","curiosityHook":"Can two adoptive brothers stay ahead of agents and mercenaries seeking an otherworldly weapon?","description":"After discovering an otherworldly weapon, a young boy uses it to protect his adoptive older brother from criminals, inadvertently drawing the crosshairs of federal agents and relentless mercenaries.","discoveryStyle":"adventurous","emotionalWeight":"moderate","filterLanguages":["English","Spanish"],"id":"kin-2018","moods":["exciting","suspenseful"],"pace":"fast","palette":["#000010","#ffffff"],"situations":["family","friends"],"tmdbId":425505,"vibeSummary":"Fast-paced and suspenseful sci-fi chase with moderate emotional weight and engaged focus.","whyWatch":"A boy’s otherworldly weapon sends him and his adoptive older brother on the run from federal agents and mercenaries."},"facts":{"countries":["United States of America"],"director":"Josh Baker & Jonathan Baker","genres":["Action","Adventure","Science Fiction","Thriller"],"posterPath":"/oPE5GXHaTlu5eRcd4USuOX3A1mf.jpg","runtimeMinutes":102,"spokenLanguages":["English","Spanish"],"title":"Kin","tmdbId":425505,"year":2018},"provenance":{"evidencePacketHash":"sha256:efc2fc3664d7a4a47a8992b42c84c1ac74299eba4421232e5aaed827a87bca35","factsRecordHash":"sha256:d00dca207188cb9a088f1c61970e42f60c02449c3ab3b354b02d12a97233f34e","finalEditorialArtifactHash":"sha256:6a2f689e5e0f2f1e6cbb8a57204822d8d72f10c26642473ddeac65c9115a4013","paletteArtifactHash":"sha256:198cdcda8a675b1927e60bfbec7d32d2913f7029478ef2d15630117acc4a7d6f","promotionCandidateHash":"sha256:155b5ef7f6ab1ab25b58e10d9e3fe826b38e5ea909d8e76ea8076517937bd226","semanticArtifactHash":"sha256:f1bb5a8a2a76e8d5038fe670c030ce88dec7d61b9d0fa1a8e5b2372b0830ab51"},"schemaVersion":"production-record.v2","tmdbId":425505}
