{"candidateId":"scale500-tmdb-10588","curatedMovie":{"attentionDemand":"easy","curiosityHook":"When playful indoor antics spiral completely out of hand, the siblings face a wild race to regain control and expel their chaotic visitor before mom returns.","description":"Left home alone on a rainy afternoon while their mother is out, siblings Conrad and Sally find their quiet house upended when the mischievous Cat in the Hat arrives and unleashes unruly fantasy mayhem.","discoveryStyle":"familiar","emotionalWeight":"light","filterLanguages":["English"],"id":"the-cat-in-the-hat-2003","moods":["funny"],"pace":"fast","palette":["#005080","#f0f0f0"],"situations":["family","easy-watch"],"tmdbId":10588,"vibeSummary":"Fast, lighthearted, and easy to watch, blending broad physical comedy with colorful, chaotic family fantasy.","whyWatch":"Clocking in at an energetic 82 minutes, Bo Welch's live-action family comedy offers fast-paced, surreal slapstick designed for easy, low-stress entertainment."},"facts":{"countries":["United States of America"],"director":"Bo Welch","genres":["Adventure","Comedy","Family","Fantasy"],"posterPath":"/uYYLz67e5xEQMsY858VSSCDsLU6.jpg","runtimeMinutes":82,"spokenLanguages":["English"],"title":"The Cat in the Hat","tmdbId":10588,"year":2003},"provenance":{"evidencePacketHash":"sha256:5c6cf67029dbc7bd8c79fc62c46a602a3b2dca6b84598596c014aa053503b8e6","factsRecordHash":"sha256:f86135962565f6b5623e44003eae88ce27f56ca1facb589f6c5c376371c62a86","finalEditorialArtifactHash":"sha256:3fb245298ec05606499d847f066a13818a6c288a16a77ca8fdd0731094788b4e","paletteArtifactHash":"sha256:cb733c6456361f208e1398e81185412e595eadbee23df605bc542a0e4e87b59e","promotionCandidateHash":"sha256:5f394452a59c6e5bd87af1d5be367e2cafef09b702ac64cfe9c65df76b77e876","semanticArtifactHash":"sha256:ca1025715a068edef051407c13d1e00b540d68b326c5f2e2b2a7ecdccb9dddcb"},"schemaVersion":"production-record.v2","tmdbId":10588}
