{"candidateId":"scale500-tmdb-9718","curatedMovie":{"attentionDemand":"easy","curiosityHook":"When an arrogant European challenger shatters Ricky Bobby's winning streak, will the fallen champion conquer his terror and reclaim the track?","description":"NASCAR sensation Ricky Bobby enjoys fame, wealth, and endless victories until flamboyant rival Jean Girard challenges his dominance, sending the daredevil driver spiraling into a paralyzing crisis of confidence.","discoveryStyle":"familiar","emotionalWeight":"light","filterLanguages":["English"],"id":"talladega-nights-the-ballad-of-ricky-bob-2006","moods":["funny","exciting"],"pace":"fast","palette":["#802020","#ffffff"],"situations":["friends","easy-watch"],"tmdbId":9718,"vibeSummary":"Fast, raucous, and completely lighthearted. An easy-watching racing farce built for big laughs with friends.","whyWatch":"Adam McKay directs a fast, wildly energetic sports comedy loaded with outsized rivalries and unhinged humor, making it an effortless crowd-pleaser for a fun group watch."},"facts":{"countries":["United States of America"],"director":"Adam McKay","genres":["Comedy"],"posterPath":"/3iCiTqsmJz1mO85AHzTiHNkRmb6.jpg","runtimeMinutes":108,"spokenLanguages":["English"],"title":"Talladega Nights: The Ballad of Ricky Bobby","tmdbId":9718,"year":2006},"provenance":{"evidencePacketHash":"sha256:9a3e9a98fb5ef571df67d4a443144cf47e3c4b9d6d16410969115be66a5e4b7a","factsRecordHash":"sha256:ea548240d125a4f5047e563bf56e43eb01b6b41946c9b886d1433963f5680769","finalEditorialArtifactHash":"sha256:eb47859d758b9d6f06ca76dabac2c0f10f8830cf1a85a07f461673f0f02b32f7","paletteArtifactHash":"sha256:32097363e83b6a0b666eda82bd27f240d4751fd44774da8135be9d7edab1b0d6","promotionCandidateHash":"sha256:7f130af5224d17255ddf0360168e9f19eb9f534154026e8e217da7bf106e19c7","semanticArtifactHash":"sha256:8950cf954cf5ed380028136d75d0d035a9f742947a23d90de38b4356539b27a5"},"schemaVersion":"production-record.v2","tmdbId":9718}
