{"candidateId":"scale500-tmdb-20533","curatedMovie":{"attentionDemand":"engaged","curiosityHook":"Can Jonah Hex halt Turnbull's devastating plan before the rogue officer unleashes his ultimate catastrophe?","description":"Commissioned by President Ulysses Grant, scarred gunslinger Jonah Hex hunts down Quentin Turnbull, a Confederate officer set on unleashing hell on earth and the man who slaughtered Hex's family.","discoveryStyle":"adventurous","emotionalWeight":"moderate","filterLanguages":["English"],"id":"jonah-hex-2010","moods":["exciting","suspenseful"],"pace":"fast","palette":["#000000","#007080"],"situations":["friends","alone"],"tmdbId":20533,"vibeSummary":"Fast, gritty, and suspenseful supernatural action built for a focused solo watch or casual group night.","whyWatch":"At a lean 81 minutes, Jimmy Hayward's fast-moving fantasy thriller fuses grit and apocalyptic stakes into a propulsive hunt fueled by pure vengeance."},"facts":{"countries":["United States of America"],"director":"Jimmy Hayward","genres":["Fantasy","Thriller","Western"],"posterPath":"/xwAdu0lOO2Y5sXjK87glhJg3c6r.jpg","runtimeMinutes":81,"spokenLanguages":["English"],"title":"Jonah Hex","tmdbId":20533,"year":2010},"provenance":{"evidencePacketHash":"sha256:d616dca9fcf20515590746759045621a4f8006c850299b01b3aa6a20e4e85a23","factsRecordHash":"sha256:b44959aeddca03682e8452935f8a5c7977f64e54e135df18fc7f29ede5a3784c","finalEditorialArtifactHash":"sha256:c1ccbd05d6439deb6fbfc5c4993f792e83ae6d27a7692a1e1db0cb68818502ca","paletteArtifactHash":"sha256:eea7247bb1a70987f3a79136ce6ec9e0c44ab7646fc5d289cca7392c61617e1a","promotionCandidateHash":"sha256:9842ebea1e70367139f9fd0afa69925ff41305866277b8db738ef611e159f5e8","semanticArtifactHash":"sha256:05dfbc2f7ec2da781b51e6ac7f47d06ee302dc09f5bc52178a2152cfefe0896e"},"schemaVersion":"production-record.v2","tmdbId":20533}
